recipe_name,ingredients,cook_time,origin
omelette,"eggs, cheese, mushrooms, spinach, tomato",15,france
grilled cheese,"bread, cheese, tomato, butter",10,america
gumbo,"roux, stock, chicken, sausage, shrimp, onion, green bell pepper, garlic, celery",360,america
chocolate chip cookies,"flour, sugar, butter, chocolate chips, egg",30,america
budae jjigae ramen,"kimchi, ginger, onion, spam, sausage, tofu, chilli paste, shin ramen",30,south korean
potato pancake, "potato, ginger, onion, flour, starch, eggs, pepper, paprika, cheese",30,european
